{
  "schema_version": "1.0",
  "scene_id": "S01",
  "assumptions": ["Lens values are full-frame-equivalent suggestions.", "The reflection effect is completed in postproduction."],
  "shots": [
    {
      "shot_id": "S01-SH001",
      "beat_ids": ["S01-B01"],
      "size": "extreme-close-up",
      "angle": "eye-level through chamber glass",
      "lens_mm": 85,
      "camera_support": "slider",
      "movement": "slow dolly out beginning on voluntary breath",
      "subject": "Ninel's eye and condensation on glass",
      "action": "eye opens; she chooses to breathe after observing the frost",
      "composition": "eye slightly below center with diagnostic reflection crossing the glass",
      "dramatic_purpose": "present life as a learned action rather than an automatic fact",
      "audio": "diagnostic countdown, chamber vibration, first dry inhale",
      "continuity": ["Frost pattern matches the later wider angle.", "Countdown reaches seven on the inhale."]
    },
    {
      "shot_id": "S01-SH002",
      "beat_ids": ["S01-B01", "S01-B02"],
      "size": "medium",
      "angle": "slightly low eye-line neutral angle",
      "lens_mm": 50,
      "camera_support": "slider locked after move",
      "movement": "complete the dolly out, then hold static",
      "subject": "Ninel seated at the chamber edge with monitor background-right",
      "action": "she sits, finds the reflection, turns away, then senses it still watching",
      "composition": "controlled central geometry; monitor occupies a dark secondary plane",
      "dramatic_purpose": "establish geography and let the anomaly occur inside one credible spatial relationship",
      "audio": "chamber seal release, fabric movement, low ship hum",
      "continuity": ["Right hand remains on chamber edge.", "Capture clean plate for monitor effect."]
    },
    {
      "shot_id": "S01-SH003",
      "beat_ids": ["S01-B02"],
      "size": "insert",
      "angle": "monitor surface at Ninel eye height",
      "lens_mm": 75,
      "camera_support": "tripod",
      "movement": "static",
      "subject": "black monitor reflection",
      "action": "reflection appears to delay its turn, then the monitor clears",
      "composition": "reflection occupies the center while real Ninel remains only as edge spill",
      "dramatic_purpose": "offer evidence without confirming whether it is objective",
      "audio": "ship hum drops slightly; no sting",
      "continuity": ["Match Ninel's head angle from SH002.", "Record clean monitor and reflection passes."]
    },
    {
      "shot_id": "S01-SH004",
      "beat_ids": ["S01-B03"],
      "size": "medium-close",
      "angle": "eye-level three-quarter arc",
      "lens_mm": 50,
      "camera_support": "compact dolly or gimbal",
      "movement": "slow arc synchronized with Ninel and ship rotation",
      "subject": "Ninel with observation slit emerging behind her",
      "action": "she questions Argo, follows the changing light, and faces the planet",
      "composition": "begin profile with negative space ahead; end with planet behind her shoulder",
      "dramatic_purpose": "turn withheld personal history into an external scale of danger",
      "audio": "dialogue, deliberate pause, subtle structural groan during ship rotation",
      "continuity": ["Show the axis reorientation during the move.", "Planet reaches final mark before the word 'failure'."]
    }
  ]
}
